{"schema_version":"1","contract_identity":"shot_cinematography_observation","contract_version":"1","observation_id":"shot-observation-unknowns-001","project_id":"project-m6-synthetic","scene_id":"scene-interior-001","shot_id":"shot-interior-001-d","evidence_reference":"evidence-synthetic-frame-004","purpose":"cinematic_observation_local_validation","classification":"internal","attributes":{"shot_scale":{"status":"observed","value":"medium_wide"},"camera_angle":{"status":"unknown"},"camera_elevation":{"status":"not_observed"},"camera_movement":{"status":"observed","value":"static"},"composition":{"status":"unknown"},"subject_count":{"status":"observed","value":2},"screen_direction":{"status":"not_applicable"},"focal_length_mm":{"status":"not_observed"}},"provenance":{"kind":"manual_observation","observer_id":"observer-fixture-author","method_identity":"manual_declaration"},"limitations":["Unknown and not-observed values remain explicitly distinct."],"observation_content_digest":"7844ebb81112acc2df2cb619325c83ceeb831b99c9cf0a3b00326c0c1bee12aa"}
