{"schema_version":"1","contract_identity":"shot_cinematography_observation","contract_version":"1","observation_id":"shot-observation-static-medium-001","project_id":"project-m6-synthetic","scene_id":"scene-courtyard-001","shot_id":"shot-courtyard-001-a","evidence_reference":"evidence-synthetic-frame-001","purpose":"cinematic_observation_local_validation","classification":"internal","attributes":{"shot_scale":{"status":"observed","value":"medium"},"camera_angle":{"status":"observed","value":"level"},"camera_elevation":{"status":"observed","value":"eye_level"},"camera_movement":{"status":"observed","value":"static"},"composition":{"status":"observed","value":"centered"},"subject_count":{"status":"observed","value":1},"screen_direction":{"status":"not_applicable"},"focal_length_mm":{"status":"not_observed"}},"provenance":{"kind":"manual_observation","observer_id":"observer-fixture-author","method_identity":"manual_declaration"},"limitations":["A manual description is an attributable observation, not truth."],"observation_content_digest":"59518c75ebb974468077ae4416706bae200156cbfdfda59fce4fd25892e99b14"}
