{"schema_version":"1","contract_identity":"shot_cinematography_observation","contract_version":"1","observation_id":"shot-observation-low-close-001","project_id":"project-m6-synthetic","scene_id":"scene-workshop-001","shot_id":"shot-workshop-001-b","evidence_reference":"evidence-synthetic-frame-002","purpose":"cinematic_observation_local_validation","classification":"internal","attributes":{"shot_scale":{"status":"observed","value":"close_up"},"camera_angle":{"status":"observed","value":"low_angle"},"camera_elevation":{"status":"observed","value":"low"},"camera_movement":{"status":"observed","value":"static"},"composition":{"status":"uncertain","value":"rule_of_thirds"},"subject_count":{"status":"observed","value":1},"screen_direction":{"status":"observed","value":"right_facing"},"focal_length_mm":{"status":"observed","value":50}},"provenance":{"kind":"synthetic_test_observation","observer_id":"observer-contract-test","method_identity":"synthetic_fixture"},"limitations":["Synthetic fixture values test contract semantics only."],"observation_content_digest":"d8325c43c7c182e6c1864648b43664f7718edfbd054328f30a6b250b5ff1b07f"}
